{
  "schema_version": 1,
  "backup_set_id": "koaryu-fixture-20260712",
  "captured_at": "2026-07-12T12:00:00Z",
  "source_project_ref": "abcdefghijklmnopqrst",
  "evidence_scope": {
    "assurance": "operator_attested_partial",
    "captured_surfaces": [
      "api_key_posture",
      "auth_core_security",
      "data_api_schema_and_grants",
      "integration_mode_posture",
      "realtime_publications",
      "storage_bucket_configuration"
    ],
    "manual_reconfiguration_required": [
      "auth_external_providers_and_oauth_credentials",
      "auth_hooks",
      "auth_smtp_sms_and_message_templates",
      "custom_domains",
      "database_network_pooler_and_ssl_settings",
      "edge_function_code_secrets_and_schedules",
      "logging_alerting_and_drains",
      "provider_plan_backups_and_pitr",
      "realtime_limits",
      "runtime_deployment_environment",
      "storage_s3_and_image_transformation_settings",
      "stripe_credentials_webhook_secrets_and_dashboard_configuration",
      "vault_secrets"
    ]
  },
  "auth": {
    "site_url_origin": "https://fixture.koaryu.invalid",
    "redirect_allow_list": [
      "https://fixture.koaryu.invalid/auth/callback"
    ],
    "email_confirmation_required": true,
    "otp_length": 8,
    "otp_expiry_seconds": 3600,
    "password_min_length": 8,
    "password_required_characters": null,
    "leaked_password_protection": false,
    "captcha_enabled": false,
    "jwt_expiry_seconds": 3600,
    "session": {
      "inactivity_timeout_seconds": null,
      "timebox_seconds": null,
      "single_session_per_user": false
    },
    "mfa": {
      "totp_api_enabled": true,
      "phone_api_enabled": false,
      "webauthn_api_enabled": false,
      "enforcement": "none"
    }
  },
  "api_keys": {
    "publishable_enabled": true,
    "secret_enabled": true,
    "legacy_anon_enabled": false,
    "legacy_service_role_enabled": false,
    "signing_algorithm": "ES256"
  },
  "data_api": {
    "exposed_schemas": [
      "public"
    ],
    "automatic_table_exposure": false,
    "grants_digest": "sha256:cccccccccccccccccccccccccccccccccccccccccccccccccccccccccccccccc"
  },
  "realtime": {
    "publications": [
      "supabase_realtime"
    ]
  },
  "storage": {
    "buckets": [
      {
        "id": "student-photos",
        "public": false,
        "file_size_limit": 5242880,
        "allowed_mime_types": [
          "image/jpeg",
          "image/png",
          "image/webp"
        ]
      }
    ]
  },
  "integrations": {
    "stripe_mode": "test",
    "email_delivery": "sink"
  }
}
